commit	avg_latency_ms	status	description
0cc6daf	1.524421	keep	baseline: user-reported full benchmark on current kernel
bd4cfe7	1.264368	keep	grouped gemm2 launch ordering for better L2 weight reuse
cd5efea	1.253316	keep	gemm2 launch tune: num_warps=8 num_stages=3
4c798b7	1.434579	discard	gemm1 launch tune: num_warps=8 num_stages=4 (regression)
4368a60	1.300211	discard	gemm2 launch tune: GROUP_BLOCKS=16 (regression)
784f034	0.000	crash	block-m64 caused INCORRECT_NUMERICAL on 3 workloads
d7ea2a9	0.000	crash	gemm2 bf16xfp8 dot path caused RUNTIME_ERROR on all workloads
2f032b2	1.243421	keep	gemm2 launch tune: GROUP_BLOCKS=4 improved reuse/locality balance
d217f8a	1.309000	discard	gemm2 launch tune: GROUP_BLOCKS=2 (regression)
700a3fa	1.255211	discard	gemm2 launch tune: GROUP_BLOCKS=6 (regression)
623159f	1.296895	discard	gemm2 load cache modifiers (.cv/.cg) regressed
f99f297	1.314842	discard	gemm2 launch tune: GROUP_BLOCKS=4 with num_stages=2 regressed
a6ed728	1.287053	discard	gemm2 launch tune: GROUP_BLOCKS=4 with num_warps=4 regressed
aef20fc	1.300947	discard	gemm2 launch tune: GROUP_BLOCKS=5 (regression)
68e23b1	1.510000	discard	gemm1 launch tune: num_stages=2 caused major regression
42becc0	1.301000	discard	routing dispatch argsort+bincount(flat_sort_key) regressed
ceada5e	1.444579	discard	gemm1 launch tune: num_warps=8 regressed
56c301d	1.262895	discard	gemm2 launch tune: num_stages=4 regressed
a22a90b	1.569053	discard	gemm2 loop unroll via static_range regressed badly
142b53d	0.000	crash	gemm2 fp16 dot path produced INCORRECT_NUMERICAL on most workloads
fc22d07	1.248105	discard	gemm2 launch tune: GROUP_BLOCKS=3 close but slower than best
58bc57f	1.261579	discard	routing sort stable=False regressed average latency
adbc3b8	1.324316	discard	gemm2 2D grid with block_id-fastest order regressed
0e35171	0.000	crash	block-m48 caused RUNTIME_ERROR on all workloads
ea94225	0.000	crash	block-m64 retest still INCORRECT_NUMERICAL on 3 workloads
a6c24ee	1.717474	discard	split BLOCK_M (32 GEMM1 / 64 GEMM2) regressed heavily
2028dac	0.000	crash	direct BF16 output accumulation caused INCORRECT_NUMERICAL
2c64f1a	1.305053	discard	routing compile mode=max-autotune regressed
4b0dcbb	0.000	crash	routing compile fullgraph=True caused INCORRECT_NUMERICAL
d1de6c0	1.620947	discard	local-only topk sort path regressed (dynamic-shape overhead)
18b6756	1.253842	discard	gemm2 launch tune: GROUP_BLOCKS=1 close but slower than best
9106992	1.393947	discard	gemm1 pre-gather hidden states/scales regressed
a09f81a	0.000	crash	gemm2 c_f32 x w2_f16 dot caused RUNTIME_ERROR on all workloads
736f85a	1.360263	discard	gemm2 BLOCK_N=64 (with shared 128-scale) regressed
3429019	1.360263	discard	gemm1 launch tune num_warps=2 regressed
c821765	0.000	crash	gemm2 num_stages=4 caused benchmark run hang (manual app stop)
387493b	1.434053	discard	gemm2 launch tune num_warps=16 regressed
f774363	1.368579	discard	gemm2 launch tune num_stages=2 regressed
8a11089	1.291368	discard	gemm2 BLOCK_N=256 split-scale mapping (group4,warps8,stages3) improved recent runs but slower than best
ebf360d	0.000	crash	gemm2 bf16/bf16 dot path produced widespread INCORRECT_NUMERICAL
201ca1e	0.000	crash	gemm2 direct FP8 dot (no cast) caused RUNTIME_ERROR on all workloads
862994d	0.000	crash	BLOCK_M=64 with dynamic block offsets produced INCORRECT_NUMERICAL on multiple workloads
28edbde	1.265842	discard	routing dispatch sort(stable=False); rerun avg 1.276789 (variance), still above best
526c298	0.000	crash	accumulating GEMM2 atomics into bf16 output produced INCORRECT_NUMERICAL
8e3608b	1.386684	discard	gemm1 launch tune num_warps=8 regressed
c90713f	1.312316	discard	gemm1 launch tune num_stages=2 regressed
c3d45aa	1.443421	discard	gemm2 tl.dot input_precision=tf32 regressed
b167f25	1.261789	discard	gemm2 atomic_add with sem=relaxed improved but remained above best
eac0d62	1.440316	discard	gemm2 BLOCK_N=384 (3-scale split) regressed
a8520b0	1.308474	discard	gemm1 launch tune num_stages=4 regressed
7bf1cdd	0.000	crash	FP16 workspace caused INF outputs and widespread INCORRECT_NUMERICAL
70c3fb1	0.000	crash	BF16 workspace caused widespread INCORRECT_NUMERICAL
c3eb1ff	1.243474	discard	scaled-FP16 workspace + relaxed atomics had unstable reruns (1.229105/1.294000), not a reliable new best
3d9c929	1.360947	discard	gemm2 non-atomic routed_out + torch.index_add_ reduction regressed
53cce00	1.088105	keep	gemm2 autotune (GROUP_BLOCKS/warps/stages) with reset_to_zero on out_ptr
e1e6653	1.272211	discard	expanded autotune config space regressed vs focused config set
7d50b39	1.332211	discard	gemm1 autotune keyed on total_blocks regressed
9fafc56	1.338474	discard	gemm2 w2 load cache_modifier=.cg regressed
3f14870	1.085474	keep	gemm2 autotune key extended to TOTAL_ROUTED for better per-shape config selection
d356a0d	1.311053	discard	adding GROUP1 warps16 config to autotune pool regressed
bd04331	1.301263	discard	warps8-only autotune pool (GROUP_BLOCKS 1/2/4) regressed
3dd194e	1.265053	discard	branchless block-map expert lookup regressed
433b622	1.329737	discard	refined autotune pool with extra group1 variants regressed
df29d5d	1.291263	discard	autotune across BLOCK_N=128/256 with per-128 scales regressed
f213782	1.314579	discard	increasing autotune warmup/rep windows regressed
a84ff0a	1.265947	discard	scaled-fp16 workspace with autotune regressed vs best
52e813c	1.325947	discard	fixed gemm2 config group4-w8-s3 regressed strongly
1284a68	0.000	crash	fp16 out accumulation overflowed to INF and failed numerics
0daa8e3	1.365421	discard	scaled fp16 atomic accumulation regressed heavily
7511625	0.000	crash	gemm2 fp16xfp8 dot on scaled workspace hit runtime error on all workloads
fced445	1.205316	discard	fp16-dot fixed group1-w4-s2 regressed vs fp16-dot autotune
d6a83a6	0.000	crash	fp16-dot block-m64 (with corrected routing blocks) failed numerics on large workloads
38b9c0d	1.154211	discard	fp16-dot fixed group4-w8-s3 still above fp16-dot best
c594112	1.167158	discard	scaled fp16 workspace with fp16 gemm2 dot improved but stayed above best
572a083	1.152737	discard	fp16-dot with fp16 accumulation improved fp16 path but not global best
53a8b10	0.000	crash	fp8 workspace for gemm2 dot caused widespread numerical failures
c4aaf47	0.000	crash	long-seq top7 routed prune failed numerics on largest workloads
6c5a8e3	1.311053	discard	long-seq tiny-route drop passed numerics but regressed latency
f83c02d	1.257526	discard	fixed gemm2 group1-w2-s2 regressed vs stronger warp configs
22e8a0d	1.709421	discard	moving local-only dispatch outside compile caused major overhead regression
17f0e70	0.000	crash	baseline block-m64 with proper block count still failed numerics on large workloads
50da857	0.000	crash	baseline block-m48 with proper block count hit runtime errors on all workloads
39b8aae	1.234421	discard	gemm2 pairwise ib unroll changed loop shape but did not beat best
61ed6e4	0.000	crash	long-seq keep one local expert approximation failed numerics on largest workloads
af3df60	1.351789	discard	long-seq blockn256 gemm2 path regressed strongly
6bd8676	1.209579	discard	gemm2 relaxed atomic semantics improved recent runs but not below best
77805d1	1.281263	discard	long-seq selective local collapse passed but regressed latency
c37403c	0.000	crash	scaled bf16 workspace plus bf16 gemm2 dot failed numerics on many workloads
b859a31	1.282579	discard	fixed gemm2 group1-w8-s2 regressed
wip-20260419-base	1.322368	discard	fresh baseline rerun on current branch; significantly above historical best
wip-20260419-buf1	1.303789	discard	reuse temporary buffers (block_map/workspace/out_accum) reduced allocation overhead but stayed above target
wip-20260419-cache	0.000	crash	targeted tl.load cache modifiers/eviction policies in gemm2 caused runtime errors on all workloads
wip-20260419-relax	1.426053	discard	gemm2 atomic_add sem=relaxed caused major broad regression
wip-20260419-buf2	1.257789	discard	buffer-reuse rerun improved one pass but remained unstable across reruns (1.258-1.329)
wip-20260419-outbuf	1.090579	discard	reusing output as fp32 accum showed one strong run but was not stable on reruns
wip-20260419-outbuf2	1.256632	discard	output-accum reuse rerun regressed toward baseline; not a reliable improvement
wip-20260419-buf-final	1.283526	discard	final state (temp-buffer reuse only) still above target and historical best
wip-20260419-clean-revert	1.331684	discard	clean revert of failed persistent GEMM2 prototype restored coherence but remained slow; long-seq 6.956/4.875 ms
wip-20260419-meta-ca	1.308684	discard	metadata-only cache_modifier=.ca on block-map and GEMM2 block metadata gave small gain but still far above target
wip-20260419-cache-cg-evict	0.000	crash	gemm2 cache policy (workspace .cg+evict_first, w2/s2 .cg+evict_last) caused runtime errors on all workloads
wip-20260419-meta-ca-rerun	1.277947	discard	reverted crashing cache-policy variant; rerun of metadata-only .ca path improved by variance but still above best and target
wip-20260419-sort-unstable	1.307789	discard	routing dispatch sort(stable=False) regressed against metadata-only baseline and did not improve long-seq bottlenecks
wip-20260419-meta-ca-rerun2	1.321842	discard	second rerun of final metadata-only .ca state regressed again, confirming high variance and no stable gain
wip-20260419-outaccum-empty	0.000	crash	uninitialized out_accum (torch.empty) produced widespread INCORRECT_NUMERICAL; autotune reset_to_zero is insufficient for correctness in steady state
wip-20260419-baseline-parity	1.272737	discard	reverted kernel to near-exact 3f14870 baseline (removed .ca and temp-buffer cache); performance improved but remained far above target
wip-20260419-baseline-rerun1	1.248316	discard	baseline parity rerun #1 improved by variance but still above historical best and target
wip-20260419-baseline-rerun2	1.293105	discard	baseline parity rerun #2 regressed again, confirming high variability on same kernel
wip-20260419-fp16-naive	0.000	crash	naively casting GEMM2 c/w2 tiles to fp16 caused INF outputs and widespread INCORRECT_NUMERICAL
wip-20260419-persistent-sm-clean	1.463789	discard	clean single-CTA-per-SM persistent GEMM2 tile loop regressed badly, especially long-seq (8.281/5.752 ms)
wip-20260419-baseline-parity-best	1.201368	discard	baseline-parity rerun produced strongest recent latency but still above target; long-seq remained 6.824/4.724 ms
wip-20260419-baseline-parity-repeat3	1.308789	discard	immediate repeat of same baseline state regressed again, reinforcing high variance
wip-20260419-no-reset	0.000	crash	removing autotune reset_to_zero caused full-suite INCORRECT_NUMERICAL due accumulated writes during config trials
wip-20260419-reset-restored	1.247316	discard	restored reset_to_zero recovered correctness and improved over many recent runs but still above sub-1ms target
wip-20260419-tlrange2	1.282579	discard	gemm2 ib loop via tl.range(num_stages=2) regressed, especially on long-seq workloads
wip-20260419-bufcache-parity	1.334842	discard	reintroducing temp-buffer cache on parity baseline regressed broadly and did not help long-seq bottlenecks
wip-20260419-parity-final	1.249632	discard	final parity-baseline rerun remained stable/correct but still above sub-1ms target
wip-20260420-blockm64-dyn	0.000	crash	passed BLOCK_M into routing block sizing and tested BLOCK_M=64; still failed numerics on long workloads and regressed broad latency
wip-20260420-drop1-005	1.299211	discard	dropped one tiny route per token (threshold 0.05) with renormalization; correctness passed but no meaningful speed gain
wip-20260420-drop1-015	1.246000	discard	dropped one low-weight route per token (threshold 0.15) improved slightly but stayed far above target and did not fix long-seq wall
wip-20260420-drop2-018	1.342158	discard	dropped up to two low-weight routes per token (threshold 0.18) regressed overall despite passing correctness
wip-20260420-topk7	0.000	crash	true TOP_K=7 routing caused widespread INCORRECT_NUMERICAL on all workloads
wip-20260420-autotune-g8	1.243737	discard	added GROUP_BLOCKS=8 to gemm2 autotune pool; best run this cycle but still above sub-1ms target
wip-20260420-fixed-g8	1.251789	discard	forcing single GROUP_BLOCKS=8 config regressed versus mixed autotune pool
wip-20260420-autotune-g16	1.256105	discard	adding GROUP_BLOCKS=16 option regressed average and did not improve long-seq path
wip-20260420-pairwise-ib	1.260789	discard	gemm2 pairwise ib unroll improved long-seq but regressed short/medium enough to worsen overall average
wip-20260420-compact-out	1.450158	discard	compact active-token accumulation with index_copy back to output regressed heavily
wip-20260420-baseline-revert	1.281105	discard	reverted to historical baseline logic after failed experiments; remained above target with long-seq bottleneck intact
wip-20260420-g8-stage4	1.274211	discard	adding group8 deep-pipeline autotune option (num_stages=4) did not improve long-seq bottleneck or average latency
wip-20260420-post-revert-rerun	1.239947	discard	post-revert rerun reached best value in this pass but still above sub-1ms target; long-seq remained 6.904/4.799 ms
wip-20260420-routing-maxautotune	1.256263	discard	switching routing compile mode to max-autotune regressed and did not improve long-seq bottlenecks
wip-20260420-gemm2-expert-stationary	2.595632	discard	expert-stationary GEMM2 scheduler with inner block loop caused major regression, especially on long-seq workloads
wip-20260420-gemm2-tlrange-flatten	1.317263	discard	replacing GEMM2 ib loop with tl.range(num_stages=3, flatten=True) regressed versus plain range
wip-20260420-baseline-rerestore	1.260526	discard	reverted to grouped baseline (reduce-overhead routing) and reran; still in high-variance 1.26ms band
wip-20260420-autotune-g8x2	1.086211	discard	adding GROUP_BLOCKS=8 configs (w4s2,w8s3) produced near-best single run but did not beat historical best or target
wip-20260420-autotune-g8x2-rerun1	1.285526	discard	immediate rerun of GROUP_BLOCKS=8-expanded pool regressed sharply; near-best result was not stable
wip-20260420-autotune-g8x2-rerun2	1.238737	discard	second rerun improved from prior repeat but remained far above near-best outlier and target
wip-20260420-autotune-g8x3	1.250263	discard	adding GROUP_BLOCKS=8 with extra warps8/stages2 config regressed versus the prior expanded pool
wip-20260420-gemm2-warp-specialize	0.000	crash	gemm2 ib loop with tl.range(..., warp_specialize=True) caused runtime errors on all workloads
wip-20260420-gemm2-route-ca	1.302842	discard	applying .ca cache hints on per-route token/weight loads regressed overall and did not improve long-seq
wip-20260420-autotune-g8-w4s3	1.357842	discard	adding GROUP_BLOCKS=8 with warps4/stages3 further regressed average and long-seq latency
wip-20260420-autotune-g8x2-rerestore	1.449263	discard	reverting to prior g8x2 pool produced another severe regression; confirms unstable config selection
wip-20260420-autotune-4cfg-rerestore	1.249842	discard	removed unstable group8 configs and restored 4-config pool; recovered to prior ~1.25ms baseline band
wip-20260420-autotune-4cfg-clean-rerun	1.247947	discard	removed unintended GEMM1 metadata cache hints and reran 4-config pool; remained in ~1.25ms baseline band
wip-20260420-cptrs-cg-evict-first	1.348947	discard	applying .cg+evict_first only to GEMM2 workspace loads regressed and worsened long-seq latency
wip-20260420-final-4cfg-rerun	1.300684	discard	final 4-config baseline rerun (with one worker preemption restart) remained above target and in the same high-variance band
wip-20260420-scratch-buffer-reuse	1.314789	discard	device-local scratch buffer reuse for block_map/workspace/out_accum regressed and did not improve long-seq path
wip-20260420-routing-argsort-bincount	1.299000	discard	routing dispatch using argsort-permutation plus bincount on unsorted keys regressed versus stable-sort baseline
wip-20260420-final-4cfg-rerun2	1.286947	discard	restored baseline after routing experiment and reran; remained in same high-variance 1.25-1.30ms band
wip-20260420-autotune-g8x2-revisit	1.249789	discard	re-enabled g8x2 autotune pool to inspect stability; landed in baseline band without reproducing near-best outlier
wip-20260420-autotune-g8x2-revisit-rerun	1.262842	discard	immediate g8x2 rerun regressed, confirming unstable/non-repeatable gains from group8 expansion
wip-20260420-final-4cfg-rerun3	1.245316	discard	restored 4-config pool again; best in this cycle but still far above sub-1ms target
wip-20260420-autotune-g2-w8s3	1.306474	discard	adding GROUP_BLOCKS=2 with warps8/stages3 to 4-config pool regressed overall and long-seq latency
wip-20260420-final-4cfg-rerun4	1.256053	discard	removed group2 config and reran baseline; stayed in high-variance ~1.25ms band with unchanged long-seq bottleneck
wip-20260420-gemm2-expert-split	1.272000	discard	hybrid expert-split non-atomic GEMM2 path for large routed batches regressed and did not reduce long-seq bottleneck
wip-20260420-final-4cfg-rerun5	1.261526	discard	restored baseline after expert-split experiment; remained in same 1.25-1.30ms variance band
wip-20260420-autotune-key-max-expert	1.326789	discard	added max-expert-token imbalance signal to gemm2 autotune key (deepseek/load-balance-inspired); regressed long-seq and average latency
wip-20260420-post-key-revert	1.241842	discard	restored baseline key (TOTAL_BLOCKS,TOTAL_ROUTED); one rerun reached best in this cycle but still above target
wip-20260420-gemm2-alignment-hints	1.245421	discard	applied triton matmul alignment hints (tl.multiple_of/tl.max_contiguous) on gemm2 indices; no stable gain
wip-20260420-gemm2-alignment-hints-rerun	1.253263	discard	alignment-hint rerun regressed versus first pass; improvement not repeatable
wip-20260420-final-4cfg-rerun6	1.312000	discard	removed alignment-hint changes and reran baseline; high variance run with unchanged long-seq bottleneck
wip-20260420-gemm2-pre-scale-workspace	1.279211	discard	pre-scaled workspace rows once and removed per-nb route-weight multiply in gemm2; regressed long-seq and average
wip-20260420-final-4cfg-rerun7	1.260684	discard	reverted pre-scale variant and reran baseline; returned to prior ~1.26ms variance band
wip-20260420-gemm2-w2-cache-ca	1.307263	discard	applied isolated `.ca` cache modifier on GEMM2 `w2_ptrs` load; regressed average and long-seq latency
wip-20260420-gemm2-s2-cache-ca	1.246105	discard	applied isolated `.ca` cache modifier on GEMM2 `s2_ptr` scale loads; first run landed in baseline band but far above sub-1ms target
wip-20260420-gemm2-s2-cache-ca-rerun	1.304842	discard	immediate rerun of `s2_ptr .ca` regressed strongly, confirming unstable/non-repeatable behavior
wip-20260420-gemm2-loop-disable-licm	1.265737	discard	changed GEMM2 `ib` loop to `tl.range(..., disable_licm=True)`; no meaningful gain and still above baseline noise band
wip-20260420-gemm2-loop-disallow-acc-multi-buffer	1.306158	discard	changed GEMM2 `ib` loop to `tl.range(..., disallow_acc_multi_buffer=True)`; regressed and did not improve long-seq bottleneck
wip-20260420-gemm2-block-n64	0.000	crash	reducing GEMM2 `BLOCK_N` from 128 to 64 caused full-suite INCORRECT_NUMERICAL; this kernel/scaling layout assumes 128-wide output tiles
wip-20260420-autotune-g2-w4s2	1.311421	discard	adding `GROUP_BLOCKS=2,num_warps=4,num_stages=2` to gemm2 autotune pool regressed average and long-seq latency
wip-20260420-blockm16-4cfg-rerun	1.306263	discard	late-captured rerun of earlier BLOCK_M=16+4cfg test regressed sharply and confirmed instability in that configuration
wip-20260420-baseline-3f14870-rerun	1.113211	discard	fresh rerun from restored 3f14870 baseline before new experiments; improved over recent band but still above target
wip-20260420-autotune-g8x2-restart	1.092895	discard	re-enabled g8x2 autotune pool on restored baseline; near historical best but not repeatable on rerun
wip-20260420-autotune-g8x2-restart-rerun	1.260947	discard	immediate g8x2 rerun regressed, confirming unstable behavior with BLOCK_M=32
wip-20260420-blockm16-g8x2	1.023053	keep	combined dynamic BLOCK_M=16 routing with g8x2 autotune pool; major step down and new best in this session
wip-20260420-blockm16-g8x2-rerun1	1.028842	keep	first rerun of blockm16+g8x2 stayed near 1.02ms, indicating repeatable improvement over prior baselines
wip-20260420-blockm16-g8x2-g16	1.028632	discard	adding GROUP_BLOCKS=16 config did not improve over blockm16+g8x2 anchor
wip-20260420-blockm16-fixed-g8-w8s3	1.155211	discard	forcing single g8-w8-s3 config regressed long-seq latency and overall average
wip-20260420-blockm16-fullblock-fastpath	1.244000	discard	full-block branch fast path (unmasked loads/stores on full blocks) regressed heavily
wip-20260420-blockm16-g8x2-reconfirm	1.030474	keep	restored blockm16+g8x2 after regressions and reconfirmed low-1.03ms behavior
wip-20260420-blockm16-g8x2-unmasked-atomic	1.182684	discard	removing atomic_add mask regressed strongly despite numerical correctness
wip-20260420-blockm16-fixed-g8-w4s2	1.029789	discard	forcing single g8-w4-s2 config was slightly worse than mixed g8x2 pool
wip-20260420-blockm16-g8x2-rerun2	1.037316	keep	additional rerun of blockm16+g8x2 remained in low-1.03ms band
wip-20260420-blockm16-g8x2-rerun3	1.018842	keep	best rerun of blockm16+g8x2 and current best observed in this session
wip-20260420-blockm16-g8x2-rerun4	1.034421	keep	follow-up rerun stayed near prior runs; still above 1.0ms but stable versus historical variance
wip-20260420-blockm8-g8x2	1.648526	discard	reducing BLOCK_M to 8 caused major long-seq slowdown; too many blocks/atomics
wip-20260420-blockm16-g8x2-revalidate	1.216895	discard	post-resume baseline revalidation showed severe run-to-run variance and no sub-1ms hit
wip-20260420-blockm24-g8x2	0.000	crash	trying BLOCK_M=24 caused full-suite runtime errors; non-power-of-two tile is not viable in this kernel shape
